{
  "schemaVersion": 1,
  "templateVersion": "1",
  "defaults": {
    "page": {
      "layout": "report"
    },
    "section": {
      "pattern": "custom",
      "container": "panel"
    },
    "block": {
      "width": "full"
    }
  },
  "hardPins": {
    "productMandatory": [
      {
        "id": "page-header",
        "mustBe": "reportHeader"
      }
    ]
  },
  "scene": "ioc-overview",
  "variant": "standard",
  "sections": [
    {
      "id": "summary",
      "pattern": "overview-with-trend",
      "container": "panel",
      "suggested": true,
      "blocks": [
        {
          "id": "primary",
          "width": "third",
          "purpose": "primary-value",
          "dataRole": "primaryValue"
        },
        {
          "id": "trend",
          "width": "two-thirds",
          "purpose": "trend",
          "dataRole": "timeSeries"
        }
      ]
    }
  ]
}
